15:13:15.082152 IP 192.168.0.247.sip > 192.168.0.156.sip: SIP: REGISTER sip:teo SIP/2.0
15:13:15.084950 IP 192.168.0.156.sip > 192.168.0.247.sip: SIP: SIP/2.0 401 Unauthorized
15:13:15.095555 IP 192.168.0.247.sip > 192.168.0.156.sip: SIP: REGISTER sip:teo SIP/2.0
15:13:15.102801 IP 192.168.0.156.sip > 192.168.0.247.sip: SIP: SIP/2.0 200 OK
15:13:15.204966 IP 192.168.0.156.sip > 192.168.0.247.sip: SIP: NOTIFY sip:2001@192.168.0.247:5060 SIP/2.0
15:13:15.259981 IP 192.168.0.247.sip > 192.168.0.156.sip: SIP: SIP/2.0 200 OK
15:15:09.401488 IP 192.168.0.247.sip > 192.168.0.156.sip: SIP: SUBSCRIBE sip:2001@192.168.0.156:5060 SIP/2.0
15:15:09.404428 IP 192.168.0.156.sip > 192.168.0.247.sip: SIP: SIP/2.0 202 Accepted
15:15:09.420330 IP 192.168.0.156.sip > 192.168.0.247.sip: SIP: NOTIFY sip:2001@192.168.0.247:5060 SIP/2.0
15:15:09.440193 IP 192.168.0.247.sip > 192.168.0.156.sip: SIP: SIP/2.0 200 OK
15:15:40.809967 IP 192.168.0.167.5989 > 192.168.0.156.sip: SIP: SUBSCRIBE sip:2000@192.168.0.156:5060 SIP/2.0
15:15:40.814443 IP 192.168.0.156.sip > 192.168.0.167.5989: SIP: SIP/2.0 202 Accepted
15:15:40.822943 IP 192.168.0.156.sip > 192.168.0.167.5989: SIP: NOTIFY sip:2000@192.168.0.167:5989 SIP/2.0
15:15:40.827756 IP 192.168.0.167.5989 > 192.168.0.156.sip: SIP: SIP/2.0 200 OK
15:18:45.665516 IP 192.168.0.167.5989 > 192.168.0.156.sip: SIP: REGISTER sip:teo SIP/2.0
15:18:45.667270 IP 192.168.0.156.sip > 192.168.0.167.5989: SIP: SIP/2.0 401 Unauthorized
15:18:45.672366 IP 192.168.0.167.5989 > 192.168.0.156.sip: SIP: REGISTER sip:teo SIP/2.0
15:18:45.680112 IP 192.168.0.156.sip > 192.168.0.167.5989: SIP: SIP/2.0 200 OK
15:18:45.744408 IP 192.168.0.156.sip > 192.168.0.167.5989: SIP: NOTIFY sip:2000@192.168.0.167:5989 SIP/2.0
15:18:45.749412 IP 192.168.0.167.5989 > 192.168.0.156.sip: SIP: SIP/2.0 200 OK
15:22:57.993045 IP 192.168.0.155.sip > 192.168.0.156.sip: SIP: REGISTER sip:teo;transport=udp SIP/2.0
15:22:57.996925 IP 192.168.0.156.sip > 192.168.0.155.sip: SIP: SIP/2.0 401 Unauthorized
15:22:58.008765 IP 192.168.0.155.sip > 192.168.0.156.sip: SIP: REGISTER sip:teo;transport=udp SIP/2.0
15:22:58.015501 IP 192.168.0.156.sip > 192.168.0.155.sip: SIP: SIP/2.0 200 OK
15:22:58.068007 IP 192.168.0.156.sip > 192.168.0.155.sip: SIP: NOTIFY sip:2002@192.168.0.155:5060;transport=udp SIP/2.0
15:22:58.083157 IP 192.168.0.155.sip > 192.168.0.156.sip: SIP: SIP/2.0 200 OK
15:26:34.442876 IP 192.168.0.167.5989 > 192.168.0.156.sip: SIP: INVITE sip:2001@teo SIP/2.0
15:26:34.444877 IP 192.168.0.156.sip > 192.168.0.167.5989: SIP: SIP/2.0 100 Trying
15:26:34.466377 IP 192.168.0.156.sip > 192.168.0.167.5989: SIP: SIP/2.0 407 Proxy Authentication Required
15:26:34.471941 IP 192.168.0.167.5989 > 192.168.0.156.sip: SIP: ACK sip:2001@teo SIP/2.0
15:26:34.474123 IP 192.168.0.167.5989 > 192.168.0.156.sip: SIP: INVITE sip:2001@teo SIP/2.0
15:26:34.474401 IP 192.168.0.156.sip > 192.168.0.167.5989: SIP: SIP/2.0 100 Trying
15:26:34.556765 IP 192.168.0.156.sip > 192.168.0.247.sip: SIP: INVITE sip:2001@192.168.0.247:5060 SIP/2.0
15:26:34.573733 IP 192.168.0.247.sip > 192.168.0.156.sip: SIP: SIP/2.0 100 Trying
15:26:34.635420 IP 192.168.0.247.sip > 192.168.0.156.sip: SIP: SIP/2.0 180 Ringing
15:26:34.647845 IP 192.168.0.156.sip > 192.168.0.167.5989: SIP: SIP/2.0 180 Ringing
15:26:34.650973 IP 192.168.0.247.sip > 192.168.0.156.sip: SIP: SIP/2.0 180 Ringing
15:26:36.694653 IP 192.168.0.247.sip > 192.168.0.156.sip: SIP: SIP/2.0 200 OK
15:26:36.700200 IP 192.168.0.156.sip > 192.168.0.247.sip: SIP: ACK sip:2001@192.168.0.247:5060 SIP/2.0
15:26:36.727313 IP 192.168.0.156.sip > 192.168.0.167.5989: SIP: SIP/2.0 200 OK
15:26:36.827828 IP 192.168.0.167.5989 > 192.168.0.156.sip: SIP: ACK sip:2001@192.168.0.156:5060;transport=udp SIP/2.0
15:26:43.639200 IP 192.168.0.247.sip > 192.168.0.156.sip: SIP: INVITE sip:teo_ucm@192.168.0.156:5060 SIP/2.0
15:26:43.639485 IP 192.168.0.156.sip > 192.168.0.247.sip: SIP: SIP/2.0 100 Trying
15:26:43.898481 IP 192.168.0.156.sip > 192.168.0.247.sip: SIP: SIP/2.0 200 OK
15:26:43.905453 IP 192.168.0.247.sip > 192.168.0.156.sip: SIP: ACK sip:teo_ucm@192.168.0.156:5060 SIP/2.0
15:26:43.973147 IP 192.168.0.247.sip > 192.168.0.156.sip: SIP: REFER sip:teo_ucm@192.168.0.156:5060 SIP/2.0
15:26:43.986541 IP 192.168.0.156.sip > 192.168.0.247.sip: SIP: SIP/2.0 202 Accepted
15:26:43.986680 IP 192.168.0.156.sip > 192.168.0.247.sip: SIP: NOTIFY sip:2001@192.168.0.247:5060 SIP/2.0
15:26:44.016632 IP 192.168.0.247.sip > 192.168.0.156.sip: SIP: SIP/2.0 200 OK
15:26:44.016874 IP 192.168.0.156.sip > 192.168.0.247.sip: SIP: BYE sip:2001@192.168.0.247:5060 SIP/2.0
15:26:44.026935 IP 192.168.0.247.sip > 192.168.0.156.sip: SIP: SIP/2.0 200 OK
15:26:44.092749 IP 192.168.0.156.sip > 192.168.0.247.sip: SIP: NOTIFY sip:2001@192.168.0.247:5060 SIP/2.0
15:26:44.137857 IP 192.168.0.247.sip > 192.168.0.156.sip: SIP: SIP/2.0 200 OK
15:26:55.657154 IP 192.168.0.155.sip > 192.168.0.156.sip: SIP: INVITE sip:*72500@teo;user=phone SIP/2.0
15:26:55.657537 IP 192.168.0.156.sip > 192.168.0.155.sip: SIP: SIP/2.0 100 Trying
15:26:55.681138 IP 192.168.0.156.sip > 192.168.0.155.sip: SIP: SIP/2.0 407 Proxy Authentication Required
15:26:55.689442 IP 192.168.0.155.sip > 192.168.0.156.sip: SIP: ACK sip:*72500@teo;user=phone SIP/2.0
15:26:55.701807 IP 192.168.0.155.sip > 192.168.0.156.sip: SIP: INVITE sip:*72500@teo;user=phone SIP/2.0
15:26:55.702121 IP 192.168.0.156.sip > 192.168.0.155.sip: SIP: SIP/2.0 100 Trying
15:26:55.767795 IP 192.168.0.156.sip > 192.168.0.155.sip: SIP: SIP/2.0 200 OK
15:26:55.780519 IP 192.168.0.155.sip > 192.168.0.156.sip: SIP: ACK sip:*72500@192.168.0.156:5060;transport=udp SIP/2.0
15:26:55.795541 IP 192.168.0.156.sip > 192.168.0.247.sip: SIP: NOTIFY sip:2001@192.168.0.247:5060 SIP/2.0
15:26:55.817222 IP 192.168.0.247.sip > 192.168.0.156.sip: SIP: SIP/2.0 200 OK
15:27:11.845979 IP 192.168.0.155.sip > 192.168.0.156.sip: SIP: BYE sip:*72500@192.168.0.156:5060;transport=udp SIP/2.0
15:27:11.876884 IP 192.168.0.156.sip > 192.168.0.155.sip: SIP: SIP/2.0 200 OK
15:27:11.894689 IP 192.168.0.156.sip > 192.168.0.167.5989: SIP: BYE sip:2000@192.168.0.167:5989 SIP/2.0
15:27:11.902279 IP 192.168.0.167.5989 > 192.168.0.156.sip: SIP: SIP/2.0 200 OK
